{
  "version": 2,
  "benchmark_id": "etcdraft-readindex-63903dd-v1",
  "benchmark_digest": "22443821b000099a9446b7c6df7b339e76b7751171b189a35bf6b9736a5c7fbf",
  "trials": [
    {
      "trial_id": "trial-candidate-v3.6.0-v2",
      "campaign_report": "../campaign/trial-candidate-v3.6.0-v2.json",
      "build_audit": "../build-audit/trial-candidate-v3.6.0-v2.json",
      "binary": "../../../../artifacts/pilots/etcdraft-readindex-v1/bin/sut-5b83c9e4579067c0-v2",
      "profile": "../../../../artifacts/profiles/etcdraft-campaign-v1.json",
      "plans": "../../../../plans/defectbench/etcdraft-63903dd-v1.json"
    },
    {
      "trial_id": "trial-fixed-63903dd-v3",
      "campaign_report": "../campaign/trial-fixed-63903dd-v3.json",
      "build_audit": "../build-audit/trial-fixed-63903dd-v3.json",
      "binary": "../../../../artifacts/pilots/etcdraft-readindex-v1/bin/sut-f2bfe81563cb2739-v3",
      "profile": "../../../../artifacts/profiles/etcdraft-campaign-v1.json",
      "plans": "../../../../plans/defectbench/etcdraft-63903dd-v1.json"
    }
  ]
}
