{
  "version": 2,
  "benchmark_id": "etcdraft-ready-must-sync-0675f3d-v1",
  "benchmark_digest": "c7364626445c6c69f955d2c33d56880abb5186917448f65fedb696e5b9748d5b",
  "trials": [
    {
      "trial_id": "trial-ready-must-sync-candidate-v1",
      "campaign_report": "../campaign/trial-ready-must-sync-candidate-v1.json",
      "build_audit": "../build-audit/trial-ready-must-sync-candidate-v1.json",
      "binary": "../../../../artifacts/pilots/etcdraft-ready-must-sync-v1/bin/sut-a277bf530a06feb0",
      "profile": "../../../../profiles/raft/ready-must-sync-v1.json",
      "plans": "../../../../plans/defectbench/etcdraft-0675f3d-v1.json"
    },
    {
      "trial_id": "trial-ready-must-sync-control-v1",
      "campaign_report": "../campaign/trial-ready-must-sync-control-v1.json",
      "build_audit": "../build-audit/trial-ready-must-sync-control-v1.json",
      "binary": "../../../../artifacts/pilots/etcdraft-ready-must-sync-v1/bin/sut-5b83c9e4579067c0",
      "profile": "../../../../profiles/raft/ready-must-sync-v1.json",
      "plans": "../../../../plans/defectbench/etcdraft-0675f3d-v1.json"
    }
  ]
}
